{"format_version":1,"engine_version":"0.1.0","api_compat_hash":"204ffe872e263449","classes":[],"events":[{"name":"trigger.entered","level":"core","doc":"A body began overlapping a trigger volume. Key: the trigger entity.","payload":[{"name":"trigger","type":"entity_ref","doc":"The trigger volume's entity."},{"name":"other","type":"entity_ref","doc":"The entity that entered."}],"compat_hash":"d9d4b0d4f4ce21a0"},{"name":"trigger.exited","level":"core","doc":"A body stopped overlapping a trigger volume. Key: the trigger entity.","payload":[{"name":"trigger","type":"entity_ref","doc":"The trigger volume's entity."},{"name":"other","type":"entity_ref","doc":"The entity that exited."}],"compat_hash":"c954eee9e00e1c41"},{"name":"contact.began","level":"core","doc":"Physics contact created between two bodies. Dispatched after the physics step in body-pair order (Appendix A phase 6). Key: each involved entity.","payload":[{"name":"self","type":"entity_ref","doc":"The listening body's entity."},{"name":"other","type":"entity_ref","doc":"The other body's entity."},{"name":"position","type":"vec3","doc":"Contact point, world space."},{"name":"normal","type":"vec3","doc":"Contact normal, world space, from self toward other."},{"name":"impulse","type":"float","doc":"Total normal impulse of the first contact."}],"compat_hash":"08d68516245c6356"},{"name":"contact.ended","level":"core","doc":"Physics contact between two bodies ceased. Dispatched after the physics step in body-pair order. Key: each involved entity.","payload":[{"name":"self","type":"entity_ref","doc":"The listening body's entity."},{"name":"other","type":"entity_ref","doc":"The other body's entity."}],"compat_hash":"b9651ca9f2ae10e3"},{"name":"state.finished","level":"core","doc":"A sequence state's playhead reached its end (end mode 'finish'). Sequence chaining rides this event (spec 4.2). Key: the owning entity.","payload":[{"name":"entity","type":"entity_ref","doc":"The entity owning the state machine."},{"name":"region","type":"name","doc":"The region containing the finished state."},{"name":"state","type":"name","doc":"The state whose sequence finished."}],"compat_hash":"a8afc4b1ee21c6e0"},{"name":"entity.spawned","level":"core","doc":"An entity went live at structural apply (Appendix A phase 8), after its initial states entered. Key: the spawned entity.","payload":[{"name":"entity","type":"entity_ref","doc":"The entity that spawned."},{"name":"parent","type":"entity_ref","doc":"The parent it was attached under."}],"compat_hash":"e749d4b199f3f803"},{"name":"entity.despawned","level":"core","doc":"An entity was removed at structural apply, after its full exit chains ran; its handles read .alive == false. Key: the despawned entity.","payload":[{"name":"entity","type":"entity_ref","doc":"The entity that despawned."}],"compat_hash":"77298a15af3d8e3e"},{"name":"action.pressed","level":"core","doc":"A named input action activated (Appendix A phase 2). Digital bindings report strength 1. Key: global.","payload":[{"name":"action","type":"name","doc":"The action-map action name."},{"name":"strength","type":"float","doc":"Activation strength in [0, 1]."},{"name":"device","type":"int","doc":"Originating device index; 0 is the primary."}],"compat_hash":"f7c859b38c3f04fd"},{"name":"action.released","level":"core","doc":"A named input action deactivated. Key: global.","payload":[{"name":"action","type":"name","doc":"The action-map action name."},{"name":"device","type":"int","doc":"Originating device index; 0 is the primary."}],"compat_hash":"419aa21d0d3630fa"}],"functions":[{"name":"int","level":"core","params":[{"name":"x","type":"float"}],"returns":"int","doc":"Convert float to int, truncating toward zero. NaN or a value outside int64 range is a runtime expression error.","compat_hash":"97aa61acc9a8e040"},{"name":"float","level":"core","params":[{"name":"x","type":"int"}],"returns":"float","doc":"Convert int to float32 (IEEE round-to-nearest).","compat_hash":"77bc1325370c7618"},{"name":"abs","level":"core","params":[{"name":"x","type":"float"}],"returns":"float","doc":"Absolute value.","compat_hash":"2be5e694437bc61c"},{"name":"sign","level":"core","params":[{"name":"x","type":"float"}],"returns":"float","doc":"1 for positive, -1 for negative, 0 for zero and NaN.","compat_hash":"296d5ef965cc7c04"},{"name":"floor","level":"core","params":[{"name":"x","type":"float"}],"returns":"float","doc":"Largest integral value <= x (exact).","compat_hash":"e54f5e9135af5e72"},{"name":"ceil","level":"core","params":[{"name":"x","type":"float"}],"returns":"float","doc":"Smallest integral value >= x (exact).","compat_hash":"3b9f82e3077fc97c"},{"name":"round","level":"core","params":[{"name":"x","type":"float"}],"returns":"float","doc":"Nearest integral value, halves away from zero (exact).","compat_hash":"2b2869a0144ed810"},{"name":"trunc","level":"core","params":[{"name":"x","type":"float"}],"returns":"float","doc":"Integral value toward zero (exact).","compat_hash":"0cfe9724f151c1c9"},{"name":"fract","level":"core","params":[{"name":"x","type":"float"}],"returns":"float","doc":"Fractional part: x - floor(x).","compat_hash":"00d5fce352c14da3"},{"name":"sqrt","level":"core","params":[{"name":"x","type":"float"}],"returns":"float","doc":"Square root (IEEE correctly rounded). Negative input yields NaN; comparisons against NaN are false.","compat_hash":"aae426be34c69e4a"},{"name":"min","level":"core","params":[{"name":"a","type":"float"},{"name":"b","type":"float"}],"returns":"float","doc":"Smaller of a and b (b < a selects b; NaN operands select a).","compat_hash":"3c704a47b5553036"},{"name":"max","level":"core","params":[{"name":"a","type":"float"},{"name":"b","type":"float"}],"returns":"float","doc":"Larger of a and b (a < b selects b; NaN operands select a).","compat_hash":"ab4ef95b37badfd8"},{"name":"clamp","level":"core","params":[{"name":"x","type":"float"},{"name":"lo","type":"float"},{"name":"hi","type":"float"}],"returns":"float","doc":"x clamped to [lo, hi].","compat_hash":"d10ee01d61c3a636"},{"name":"saturate","level":"core","params":[{"name":"x","type":"float"}],"returns":"float","doc":"x clamped to [0, 1].","compat_hash":"848a4a2a2801d84e"},{"name":"lerp","level":"core","params":[{"name":"a","type":"float"},{"name":"b","type":"float"},{"name":"t","type":"float"}],"returns":"float","doc":"Linear blend a + (b - a) * t.","compat_hash":"0944ebe3db2577e4"},{"name":"vec2","level":"core","params":[{"name":"x","type":"float"},{"name":"y","type":"float"}],"returns":"vec2","doc":"Construct a vec2 from components.","compat_hash":"70f80b50873f6801"},{"name":"vec3","level":"core","params":[{"name":"x","type":"float"},{"name":"y","type":"float"},{"name":"z","type":"float"}],"returns":"vec3","doc":"Construct a vec3 from components.","compat_hash":"1088c11f718323ef"},{"name":"vec4","level":"core","params":[{"name":"x","type":"float"},{"name":"y","type":"float"},{"name":"z","type":"float"},{"name":"w","type":"float"}],"returns":"vec4","doc":"Construct a vec4 from components.","compat_hash":"aec17f3cad127096"},{"name":"quat","level":"core","params":[{"name":"x","type":"float"},{"name":"y","type":"float"},{"name":"z","type":"float"},{"name":"w","type":"float"}],"returns":"quat","doc":"Construct a quaternion from raw components (NOT normalized; rotation use requires unit length — core/math policy).","compat_hash":"cdc7f2fd7306d364"},{"name":"dot","level":"core","params":[{"name":"a","type":"vec3"},{"name":"b","type":"vec3"}],"returns":"float","doc":"Dot product.","compat_hash":"45304b27cc0a68c3"},{"name":"cross","level":"core","params":[{"name":"a","type":"vec3"},{"name":"b","type":"vec3"}],"returns":"vec3","doc":"Cross product (right-handed).","compat_hash":"85571dff02a189d9"},{"name":"length","level":"core","params":[{"name":"v","type":"vec3"}],"returns":"float","doc":"Euclidean length.","compat_hash":"afa1e751e469324c"},{"name":"length_squared","level":"core","params":[{"name":"v","type":"vec3"}],"returns":"float","doc":"Squared length (no sqrt — cheaper for radius checks).","compat_hash":"f8911f262ef12ccf"},{"name":"normalize","level":"core","params":[{"name":"v","type":"vec3"}],"returns":"vec3","doc":"Unit vector; the zero vector normalizes to zero (core/math policy).","compat_hash":"800d5528e1bc254d"},{"name":"distance","level":"core","params":[{"name":"a","type":"vec3"},{"name":"b","type":"vec3"}],"returns":"float","doc":"Euclidean distance between points.","compat_hash":"13d9eeac8b5a9f86"},{"name":"distance_squared","level":"core","params":[{"name":"a","type":"vec3"},{"name":"b","type":"vec3"}],"returns":"float","doc":"Squared distance (no sqrt — cheaper for radius checks).","compat_hash":"cdca8cde3ff914ad"},{"name":"rotate","level":"core","params":[{"name":"q","type":"quat"},{"name":"v","type":"vec3"}],"returns":"vec3","doc":"Rotate v by the UNIT quaternion q.","compat_hash":"81253976db5c7276"}],"verbs":[{"name":"version","summary":"print engine name, version, and build info","flags":[],"positionals":[],"compat_hash":"65ca0a75d45f9a01"},{"name":"selftest","summary":"run the doctest registry embedded in the engine binary","flags":[{"name":"filter","type":"string","required":false,"doc":"doctest test-case filter pattern (e.g. 'cli.*')"}],"positionals":[],"compat_hash":"8baedffec8c4c9e8"},{"name":"help","summary":"show the verb list or one verb's flags and usage","flags":[],"positionals":[{"name":"verb","type":"name","required":false,"variadic":false,"doc":"verb to describe; omit for the full verb list"}],"compat_hash":"4addeb5d102e6d5c"},{"name":"api","summary":"emit, diff, or generate from engine_api.json, the canonical API document","flags":[{"name":"out","type":"string","required":false,"doc":"dump: write the document to this path instead of printing it"},{"name":"out-dir","type":"string","required":false,"default":"api","doc":"codegen: directory for the four generated artifacts"},{"name":"cache-dir","type":"string","required":false,"default":".midday-cache/ts","doc":"codegen: TS to